{
  "generated_from": "materials/blinkist/clone.yaml",
  "opencli_version": "1.8.6",
  "profiles": {
    "book-detail": {
      "failure_paths": [
        "book-detail-not-found"
      ],
      "label": "blinkist book detail (derived draft)",
      "local_semantics": [
        "Local clone semantics are enforced at the server boundary."
      ],
      "network": {
        "allowlist": [
          "127.0.0.1",
          "localhost"
        ],
        "notes": "Only local verifier/candidate hostnames are expected."
      },
      "recovery_paths": [
        "book-detail-recover"
      ],
      "steps": [
        {
          "command": "state",
          "id": "book-detail",
          "intent": "Exercise clone check book-detail (GET /app/books/atomic-habits-en).",
          "observation_id": "blinkist_book-detail",
          "required_state": {
            "text_absent": "NotImplementedError",
            "visible": "Atomic Habits"
          },
          "route": "app/books/atomic-habits-en"
        }
      ],
      "tier": "p1"
    },
    "for-you": {
      "failure_paths": [],
      "label": "blinkist for you (derived draft)",
      "local_semantics": [
        "Local clone semantics are enforced at the server boundary."
      ],
      "network": {
        "allowlist": [
          "127.0.0.1",
          "localhost"
        ],
        "notes": "Only local verifier/candidate hostnames are expected."
      },
      "recovery_paths": [
        "for-you-recover"
      ],
      "steps": [
        {
          "command": "state",
          "id": "for-you",
          "intent": "Exercise clone check for-you (GET /en/app/for-you).",
          "observation_id": "blinkist_for-you",
          "required_state": {
            "text_absent": "NotImplementedError",
            "visible": "Masterclasses"
          },
          "route": "en/app/for-you"
        }
      ],
      "tier": "p1"
    }
  },
  "schema_version": "websitebench.harbor.opencli-interaction-contract.v1",
  "site_id": "blinkist"
}
